{
  "candidate_count": 60,
  "candidate_manifest_sha256": "b26a90a50ef50e0fa827315683ce7fdd98c89cc84e985229e04df17e2e7536bf",
  "candidates": [
    {
      "api_url": "https://api.github.com/repos/IKnowUCantPvp/Lung-Sound-Classification-PCEN/contents/results.md?ref=fac0fc2d1692a0a992860c4a457ec38b325e8aa4",
      "blob_sha": "3b10ee721bf63bfc69e75020882f3c74e3174782",
      "candidate_id": "candidate-001",
      "commit": "fac0fc2d1692a0a992860c4a457ec38b325e8aa4",
      "default_branch": "main",
      "frame": "search-01",
      "immutable_url": "https://github.com/IKnowUCantPvp/Lung-Sound-Classification-PCEN/blob/fac0fc2d1692a0a992860c4a457ec38b325e8aa4/results.md",
      "indexed_blob_sha": "3b10ee721bf63bfc69e75020882f3c74e3174782",
      "owner": "IKnowUCantPvp",
      "path": "results.md",
      "repository": "IKnowUCantPvp/Lung-Sound-Classification-PCEN",
      "selection_digest": "005e834a0cec586ec188a3fdab9595551159b85900dd8239d30142d472f986b7",
      "source_bytes": 5086,
      "source_file": "sources/candidate-001.txt",
      "source_sha256": "17b9786541993a0d4d3ba8e4d306484678e49548682c5d1ae695977a6d32a82c"
    },
    {
      "api_url": "https://api.github.com/repos/xiaomi-research/guievalkit/contents/docs/results.md?ref=d5e954e5865eebaa10729c8ef38c8bda6025afde",
      "blob_sha": "0212c88d987e7ebe08a5eb0b657250a9a770b56a",
      "candidate_id": "candidate-002",
      "commit": "d5e954e5865eebaa10729c8ef38c8bda6025afde",
      "default_branch": "main",
      "frame": "search-01",
      "immutable_url": "https://github.com/xiaomi-research/guievalkit/blob/d5e954e5865eebaa10729c8ef38c8bda6025afde/docs/results.md",
      "indexed_blob_sha": "0212c88d987e7ebe08a5eb0b657250a9a770b56a",
      "owner": "xiaomi-research",
      "path": "docs/results.md",
      "repository": "xiaomi-research/guievalkit",
      "selection_digest": "06c30229fafb9196fb9fd02b79f1a719d8f2a6c413ebdb45e7a8274f63b631a5",
      "source_bytes": 5804,
      "source_file": "sources/candidate-002.txt",
      "source_sha256": "b0a4f5d4441fa9482dc8d342f048060f0d03c810796bc9a513c942e82cec102a"
    },
    {
      "api_url": "https://api.github.com/repos/ratel-ai/ratel-bench/contents/RESULTS.md?ref=d3713c1a1d8684768a2b938f3af80b579f5965a2",
      "blob_sha": "bf7b1b6c9ae8973cf8fc5baa43dcded0510749c7",
      "candidate_id": "candidate-003",
      "commit": "d3713c1a1d8684768a2b938f3af80b579f5965a2",
      "default_branch": "main",
      "frame": "search-01",
      "immutable_url": "https://github.com/ratel-ai/ratel-bench/blob/d3713c1a1d8684768a2b938f3af80b579f5965a2/RESULTS.md",
      "indexed_blob_sha": "bf7b1b6c9ae8973cf8fc5baa43dcded0510749c7",
      "owner": "ratel-ai",
      "path": "RESULTS.md",
      "repository": "ratel-ai/ratel-bench",
      "selection_digest": "0bc169e826b7204e254c9a51468387b1e2d0aaf88628cfe99b2570a38719b578",
      "source_bytes": 12262,
      "source_file": "sources/candidate-003.txt",
      "source_sha256": "f159f3181fc7697ee4ecb4d036bc8206215f03f4c4401d7995578c7f557cfd05"
    },
    {
      "api_url": "https://api.github.com/repos/oyama/pico-neural-amp-modeler-demo/contents/RESULTS.md?ref=6859450be19577002cfd24b830accb6313aca565",
      "blob_sha": "d4e843b993d3f5ffa07f2cb3a50ec598ab8f3f15",
      "candidate_id": "candidate-004",
      "commit": "6859450be19577002cfd24b830accb6313aca565",
      "default_branch": "main",
      "frame": "search-02",
      "immutable_url": "https://github.com/oyama/pico-neural-amp-modeler-demo/blob/6859450be19577002cfd24b830accb6313aca565/RESULTS.md",
      "indexed_blob_sha": "d4e843b993d3f5ffa07f2cb3a50ec598ab8f3f15",
      "owner": "oyama",
      "path": "RESULTS.md",
      "repository": "oyama/pico-neural-amp-modeler-demo",
      "selection_digest": "005450f7dbb71b4f0371d66179430e934c560f02c4927d1cbdc2755413234b09",
      "source_bytes": 7840,
      "source_file": "sources/candidate-004.txt",
      "source_sha256": "9e96b9555aeeaa57f3b45a39baba92a9ef3103589318ea9d35c63a589a0033ba"
    },
    {
      "api_url": "https://api.github.com/repos/PixelML/luce-megakernel/contents/RESULTS.md?ref=bab084443f14e6ab3ba76f8e8e3f721ad2e56144",
      "blob_sha": "873d152847040f87ff981cb191005ea6691d758a",
      "candidate_id": "candidate-005",
      "commit": "bab084443f14e6ab3ba76f8e8e3f721ad2e56144",
      "default_branch": "main",
      "frame": "search-02",
      "immutable_url": "https://github.com/PixelML/luce-megakernel/blob/bab084443f14e6ab3ba76f8e8e3f721ad2e56144/RESULTS.md",
      "indexed_blob_sha": "873d152847040f87ff981cb191005ea6691d758a",
      "owner": "PixelML",
      "path": "RESULTS.md",
      "repository": "PixelML/luce-megakernel",
      "selection_digest": "00cd4e3b6f6114f3f9148335e4dcbf753ea6bae9fc2072d70fadcad9bd03ae53",
      "source_bytes": 2332,
      "source_file": "sources/candidate-005.txt",
      "source_sha256": "b6befe4e444bf32ac478b5ec8caa563cf3602e011eada94067014f17ba303dcb"
    },
    {
      "api_url": "https://api.github.com/repos/GioiaZheng/msmarco-genqa/contents/RESULTS.md?ref=4572da75131a2370cd7c49e67c47725979160c78",
      "blob_sha": "92fc89181ad5d7ef149d9541598d4fa6db1c24a2",
      "candidate_id": "candidate-006",
      "commit": "4572da75131a2370cd7c49e67c47725979160c78",
      "default_branch": "main",
      "frame": "search-02",
      "immutable_url": "https://github.com/GioiaZheng/msmarco-genqa/blob/4572da75131a2370cd7c49e67c47725979160c78/RESULTS.md",
      "indexed_blob_sha": "92fc89181ad5d7ef149d9541598d4fa6db1c24a2",
      "owner": "GioiaZheng",
      "path": "RESULTS.md",
      "repository": "GioiaZheng/msmarco-genqa",
      "selection_digest": "01b430c66a28eefc38eecb726e05314909845f7bef23fbd313e0e5e5b2459fdb",
      "source_bytes": 14722,
      "source_file": "sources/candidate-006.txt",
      "source_sha256": "0d740e7bd24cc417ffa1ea9323be775650f55c0e550895543c267472331c112a"
    },
    {
      "api_url": "https://api.github.com/repos/hoangsonww/Spot-the-Scam-AI-Job-Fraud/contents/RESULTS.md?ref=814b57e7f7733abfb601abfc015096d67e29595f",
      "blob_sha": "93b751420ece2a17e453e4679816d4a6de96913d",
      "candidate_id": "candidate-007",
      "commit": "814b57e7f7733abfb601abfc015096d67e29595f",
      "default_branch": "master",
      "frame": "search-03",
      "immutable_url": "https://github.com/hoangsonww/Spot-the-Scam-AI-Job-Fraud/blob/814b57e7f7733abfb601abfc015096d67e29595f/RESULTS.md",
      "indexed_blob_sha": "93b751420ece2a17e453e4679816d4a6de96913d",
      "owner": "hoangsonww",
      "path": "RESULTS.md",
      "repository": "hoangsonww/Spot-the-Scam-AI-Job-Fraud",
      "selection_digest": "03f4eae4ff280207f9f6fd2de791055d40519ee7c2c1433240f6ccd4c6825e82",
      "source_bytes": 7842,
      "source_file": "sources/candidate-007.txt",
      "source_sha256": "627ab2b8e4023a626176a34fdf20b4343c6bfe77939570ddfe7e6984c37e6fa5"
    },
    {
      "api_url": "https://api.github.com/repos/telagod/abyss/contents/eval/RESULTS.md?ref=92cda135a4573052081a65774a9f3b2c1c9ae6e2",
      "blob_sha": "fa31b370ba5f1cd3f1d826ff74f38d5baede38d6",
      "candidate_id": "candidate-008",
      "commit": "92cda135a4573052081a65774a9f3b2c1c9ae6e2",
      "default_branch": "main",
      "frame": "search-03",
      "immutable_url": "https://github.com/telagod/abyss/blob/92cda135a4573052081a65774a9f3b2c1c9ae6e2/eval/RESULTS.md",
      "indexed_blob_sha": "fa31b370ba5f1cd3f1d826ff74f38d5baede38d6",
      "owner": "telagod",
      "path": "eval/RESULTS.md",
      "repository": "telagod/abyss",
      "selection_digest": "052fff705ea3229ffda3279da2dae1a2ec530e5eba304d52f32c895c3da774f0",
      "source_bytes": 33615,
      "source_file": "sources/candidate-008.txt",
      "source_sha256": "319d0eb10dd236c1097f28595a16a684d0a4775d9df2d4b7109166bde9d3ba8b"
    },
    {
      "api_url": "https://api.github.com/repos/open-compress/claw-compactor/contents/benchmark/RESULTS.md?ref=c1b936d40b1145c7a257bd6e34a17994f467495f",
      "blob_sha": "6285a82ee3be77d0edbdbaa340e0f35fdeaa67a5",
      "candidate_id": "candidate-009",
      "commit": "c1b936d40b1145c7a257bd6e34a17994f467495f",
      "default_branch": "main",
      "frame": "search-03",
      "immutable_url": "https://github.com/open-compress/claw-compactor/blob/c1b936d40b1145c7a257bd6e34a17994f467495f/benchmark/RESULTS.md",
      "indexed_blob_sha": "6285a82ee3be77d0edbdbaa340e0f35fdeaa67a5",
      "owner": "open-compress",
      "path": "benchmark/RESULTS.md",
      "repository": "open-compress/claw-compactor",
      "selection_digest": "078b278e59126b82f369aaa0d945ae8f01c79513fff0e16f992433c76617023e",
      "source_bytes": 5904,
      "source_file": "sources/candidate-009.txt",
      "source_sha256": "26b1179f59c2d8b6e6330a8f9ef6514e76641edd29c49301f6e697cda69c5b67"
    },
    {
      "api_url": "https://api.github.com/repos/pranavsinghps1/DEDL/contents/RESULTS.md?ref=263408404f6648a666e49e4fdfc24f5a8a479592",
      "blob_sha": "15b6de0f459bf462322142b22ea3a4029dd11974",
      "candidate_id": "candidate-010",
      "commit": "263408404f6648a666e49e4fdfc24f5a8a479592",
      "default_branch": "main",
      "frame": "search-04",
      "immutable_url": "https://github.com/pranavsinghps1/DEDL/blob/263408404f6648a666e49e4fdfc24f5a8a479592/RESULTS.md",
      "indexed_blob_sha": "15b6de0f459bf462322142b22ea3a4029dd11974",
      "owner": "pranavsinghps1",
      "path": "RESULTS.md",
      "repository": "pranavsinghps1/DEDL",
      "selection_digest": "02e528dddb03ecf3bbdd3786066987282124fd5a49acc9a9170410f526f1c0a4",
      "source_bytes": 3577,
      "source_file": "sources/candidate-010.txt",
      "source_sha256": "bdde022b34dfdbd64392f782f09345238059a7cfb602ac4f61e8c22c2dd0e3fd"
    },
    {
      "api_url": "https://api.github.com/repos/SenuaLab/EEG-IED-Detection/contents/docs/RESULTS.md?ref=150006a40d5fe44a7bbc67ab56b098521ce65ebd",
      "blob_sha": "5d85adfabb14f5006df16fa7a49fca5a3cce9c40",
      "candidate_id": "candidate-011",
      "commit": "150006a40d5fe44a7bbc67ab56b098521ce65ebd",